{
  "summary": "教材の技術と学習順序を確認しました",
  "scope": {
    "target": "docs",
    "reviewedFiles": [
      "docs/intro.md",
      "docs/setup.mdx"
    ],
    "excludedFiles": [
      "dist/generated.md"
    ],
    "assumptions": [
      "想定読者はJava初学者（推定）"
    ]
  },
  "scores": {
    "technicalAccuracy": {
      "score": 4,
      "reason": "根拠のある評価"
    },
    "instructionalDesign": {
      "score": 4,
      "reason": "根拠のある評価"
    },
    "explanationQuality": {
      "score": 4,
      "reason": "根拠のある評価"
    },
    "crossPageConsistency": {
      "score": 4,
      "reason": "根拠のある評価"
    },
    "practicalApplicability": {
      "score": 4,
      "reason": "根拠のある評価"
    }
  },
  "findings": [
    {
      "severity": "HIGH",
      "file": "docs/intro.md",
      "heading": "導入",
      "line": 3,
      "category": "Instructional Design",
      "issue": "未説明の概念を使用",
      "whyItMatters": "初学者が前提を誤解する",
      "suggestedImprovement": "先に概念を説明する"
    }
  ],
  "crossPageFindings": [
  {
    "aspect": "CONTRADICTION",
    "finding": {
      "severity": "CRITICAL",
      "file": "docs/setup.mdx",
      "heading": null,
      "line": null,
      "category": "Cross-page Consistency",
      "issue": "ページ間で接続先の設定が矛盾",
      "whyItMatters": "手順どおりに学ぶ受講者が接続できない",
      "suggestedImprovement": "導入と設定ページの値を統一する"
    }
  }
],
  "missingExplanations": [],
  "recommendedAdditions": [
    "導入に図を追加"
  ],
  "appendixCandidates": [],
  "positiveFindings": [
    "再現可能なコード例"
  ],
  "recommendedFixOrder": [
    "Phase 2: 前提概念を説明"
  ],
  "validationResults": [
    {
      "command": "npm run build",
      "status": "NOT_RUN",
      "details": "read-only sandboxで生成ファイルを書き込めない"
    }
  ],
  "warnings": []
}
